"","Species","Description","Cultivar","Trait","data"
"1","Geijera parviflora","Australian-Willow is an attractive evergreen, 30 to 35 feet tall and 20 feet wide, with an upright, oval silhouette.  The main inner branches are composed of strong, wind-resistant wood and are directed upward, while the outer smaller branches are somewhat pendulous.  This gives a decided weeping habit to older trees.  Younger trees are more oval-shaped.  This characteristic, combined with the thin, narrow, three to six-inch-long, olive green leaves which droop from the branches, gives the tree much the same effect as a Weeping Willow.  Short panicles of small, creamy white, showy flowers appear in early spring and early fall.",NA,"Leaf type","simple"
"2","Quercus rubra","An adaptable, widely planted oak with a rapid growth rate, red oak will reach a height of 60 to 70 feet and a spread of 40 to 60 feet when open-grown, and is native to rich woodland areas where it will grow to 90 feet tall. Branches and upper trunk are marked with long, light grey longitudinal lines which remind some people of ski trails. Open-grown trees form a rounded crown which makes a nice shade, park, or street tree. Many communities use red oak as a street tree where overhead space is not limiting. Acorns are small and easily cleaned up, broken into small pieces by pedestrians or eaten by squirrels. The foliage turns a wonderful dark red in the fall.",NA,"Leaf type","simple"
"3","Carpinus caroliniana","A handsome tree in many locations, the tree slowly reaches a height and spread of 20 to 30 feet. It will grow with an attractive open habit in total shade, but be dense in full sun. The muscle-like bark is smooth, gray, and fluted. Ironwood has a slow growth rate and is reportedly difficult to transplant from a field nursery (although 10-inch-diameter trees were moved with a 90-inch tree spade during the winter in USDA hardiness zone 8b with no problem) but is easy from containers. The fall color is faintly orange to yellow and stands out in the landscape or woods in the fall. Brown leaves occasionally hang on the tree into the winter.",NA,"Leaf type","simple"
"4","Callistemon citrinus","The common name ""bottlebrush"", perfectly describes this evergreen plant's bright red flower spikes. Hummingbirds love the flowers, and the plant is hardier than most bottlebrushes. The flowers are followed by small, woody capsules that look like bead bracelets on the bark, and which last for years. Offered as a shrub, bottlebrush can be trained as a tree to 15-feet or espaliered as a quick wall cover. It makes a nice screen or tall unclipped hedge. Pruning to develop several trunks and removing some lower branches can create a fine small specimen tree.",NA,"Leaf type","simple"
"5","Nerium oleander","Oleander is a wonderful easy-care, rounded shrub or small tree, with long, dark green leaves and an abundance of single or double, sometimes fragrant flowers. 'Mrs. Roeding' has double pink flowers. Often trained into an attractive small tree, multi-branched oleander also does well as a quick-growing screen or large specimen planting. Planted on five to seven foot centers, a row of oleander makes a nice screen for a large residence or other large-scale landscape.","Mrs. Roeding","Leaf type","simple"
"6","Delonix regia","This many-branched, broad, spreading, flat-crowned deciduous tree is well-known for its brilliant display of red-orange bloom, literally covering the tree tops from May to July. There is nothing like a Royal Poinciana (or better yet, a group of them) in full bloom. The fine, soft, delicate leaflets afford dappled shade during the remainder of the growing season, making Royal Poinciana a favorite shade tree or freestanding specimens in large, open lawns. The tree is often broader than tall, growing about 40 feet high and 60 feet wide. Trunks can become as large as 50 inches or more in diameter. Eighteen-inch-long, dark brown seed pods hang on the tree throughout the winter, then fall on the ground in spring creating a nuisance.",NA,"Leaf type","bipinnately compound"
"7","Cupressus macrocarpa","Monterey cypress thrive near the sea on the west coast of the United States, where it is native to the Monterey Bay, California, area. It has a high wind tolerance, becoming increasingly more attractive under heavy wind conditions. Narrow and pyramid-shaped when young, monterey cypress spreads with age, and can become 70 to 90 feet in height. It is one of the major trees planted to hold the sands in Golden Gate Park, San Francisco, but unfortunately many are dying. The plant is only grown in the western states.",NA,"Leaf type","simple"
"8","Sapium sebiferum","With oval, pointed, deciduous leaves and an oval, open canopy, Chinese tallowtree creates soft, dappled shade. The trunk normally dominates, snaking up through the crown sporting major limbs well spaced along the trunk. Enough light will penetrate to allow lawn grasses to thrive beneath this rapidly-growing, 30- to 35-foot-tall tree. Yellow, terminal flower spikes appear in spring and are followed by brown capsules which burst and fall off, leaving behind wax-coated, white, berrylike seeds, hence the common name, popcorn tree. These berries persist throughout the winter, even after the fluttering, heart-shaped leaves have turned gorgeous autumn shades of red, yellow or orange and have fallen. Tallowtree is one of the only reliable fall coloring trees for USDA hardiness zones 8b and 9a.  The new growth in spring is red-tinged. The waxy coating on the seeds is extracted by the Chinese for use in candles and soap and the milky sap inside the twigs is poisonous.",NA,"Leaf type","simple"
"9","Acer negundo","Boxelder forms a 40-to 50-foot-tall rounded canopy of very light green foliage edged with yellow. The unusual foliage of this cultivar makes this a difficult tree to work into most landscapes. The boxelder is an undesirable tree for many urban situations and in some cities, planting it may be illegal. The undesirable characteristics are brittle, weak wood, short life, susceptibility to boxelder bug, and trunk decay. But the tree will grow just about anywhere and therefore it may have uses due to its adaptability. The best thing about the tree is that it will grow on adverse sites where more desirable trees may not. If you use the tree, plant it for its quick growth, but interplant with more desirable trees to provide for a lasting tree canopy. Boxelder is native along streambanks over a wide area of the United States, grows along flood plains, and naturalizes quickly on disturbed sites. It may be best to restrict planting to these areas. It is tolerant of drought and was planted as a shelter-belt tree.","Elegans","Leaf type","odd-pinnately compound"
"10","Acer negundo","Boxelder forms a 40-to 50-foot-tall rounded canopy of very light green foliage tinged pink in the spring. Some of the pink may hang on throughout the year in the north and the leaf margins may remain whitish. The boxelder is an undesirable tree for many urban situations and in some cities, planting it may be illegal. The undesirable characteristics are brittle, weak wood, short life, susceptibility to boxelder bug, and trunk decay. But the tree will grow just about anywhere and therefore it may have uses due to its adaptability. The best thing about the tree is that it will grow on adverse sites where more desirable trees may not. If you use the tree, plant it for its quick growth, but interplant with more desirable trees to provide for a lasting tree canopy. Boxelder is native along streambanks over a wide area of the United States, grows along flood plains, and naturalizes quickly on disturbed sites. It may be best to restrict planting to these areas. It is tolerant of drought and was planted as a shelter-belt tree.","Flamingo","Leaf type","odd-pinnately compound"
"11","Acer palmatum","This cultivar of Japanese maple has a height and spread of about 12 feet. The multiple trunks are picturesque, grey, and show nicely when lit up at night. 'Burgundy Lace' Japanese maple is grown for its purple-red colored leaves, interesting growth habit, and fine leaf texture. Leaves are dissected almost to the petiole. The red leaf color is best as the new leaves emerge in the spring and in the fall. Leaves turn almost green during the heat of the summer. Growth habit is more like a large shrub with branches to the ground. This may be the best way to grow this tree to show off its wonderful texture. Be sure to clear all turf away from beneath the branches of these low growing types so the lawn mower will not damage the tree. This compact cultivar makes a wonderful accent for any landscape.","Burgundy Lace","Leaf type","simple"
"12","Acer palmatum","This cultivar of Japanese maple has a height and spread of about 12 feet. The multiple trunks are picturesque, grey, and show nicely when lit up at night. Japanese maple is grown for its red-colored leaves, interesting growth habit and fine leaf texture. Fall color is a dark burgundy-red and is often striking, even on trees grown in shade. Growth habit, is a weeping globe, branching to the ground. The globose selections look best when they are allowed to branch to the ground. Be sure to clear all turf away from beneath the branches of these low growing types so the lawn mower will not damage the tree. This compact cultivar makes a wonderful accent for any landscape.","Ornatum","Leaf type","simple"
"13","Acer palmatum","This red leaf Japanese maple has finely-divided, lacy leaves of a deep red in the spring but foliage color fades to light green in early summer. Leaves take on a beautiful golden, orange or red color in fall. A small, deciduous tree with delicate, upright branches, 'Atropurpureum' Japanese maple reaches a height and spread of about 20 feet, forming a vase shaped specimen tree. The multiple trunks are picturesque and show nicely when lit up at night from beneath the canopy. This cultivar of Japanese maple is grown for its colored leaves and interesting growth habit.","Atropurpureum","Leaf type","simple"
"14","Acer saccharum","This cultivar of sugar maple is very upright and compact. The tree will probably reach 60 feet at maturity in a landscape, but it will grow slowly. The crown spreads slowly to about 15 feet wide. It grows about one foot or less each year in most soils but is sensitive to reflected heat, and to drought, turning the leaves brown (scorch) along their edges. Leaf scorch from dry soil is often evident in areas where the root system is restricted to a small soil area, such as a street tree planting. It is more drought-tolerant in open areas where the roots can proliferate into a large soil space.","Newton Sentry","Leaf type","simple"
"15","Acer platanoides","This cultivar of Norway maple has a height and spread of 15 to 20 feet. The dense, compact, rounded crown fills with greenish-yellow flowers in the spring. Norway maple's dense shade and shallow root system competes with lawn grasses, and the shallow roots can make mowing under the tree a little difficult, but this is less of a problem on this small cultivar. The tree is easily transplanted, grows slowly, is adapted to a wide variety of soils (including alkaline), and has brilliant yellow fall color unmatched by most trees. It can also tolerate coastal conditions. Well adapted to street tree plantings where there are overhead wires. If you are looking for a compact, meatball-on-a-stick tree that requires no pruning, this may be the tree for you.","Globosum","Leaf type","simple"
"16","Acer platanoides","This cultivar of Norway maple has a height and spread of about 25 feet but can grow taller when shaded on the sides. The rounded crown fills with greenish-yellow flowers in the spring. Norway maple's dense shade and shallow root system competes with lawn grasses, and the shallow roots can make mowing under the tree difficult. The shallow roots can heave sidewalks (probably not as bad as the species) so be certain to locate the tree 4 to 6 feet away. The tree is easily transplanted, grows quickly, is adapted to a wide variety of soils (including alkaline), and has brilliant yellow fall color unmatched by most trees. It can also tolerate coastal conditions. Well adapted to street tree plantings, the species is often overused but this cultivar could be used more due to its small size.","Almira","Leaf type","simple"
"17","Acer platanoides","This cultivar of Norway maple grows to a height of about 50 feet with a very narrow crown. There may be confusion in the trade on how to separate this from the cultivar 'Columnare'. The columnar or fastigiate crown fills with greenish-yellow flowers in the spring. Norway maple's shallow root system competes with lawn grasses, and the shallow roots can make mowing under the tree difficult. The shallow roots can heave sidewalks so be certain to locate the tree four to six feet away. The tree is easily transplanted, grows quickly, is adapted to a wide variety of soils (including alkaline), and has brilliant orange-yellow fall color unmatched by most trees. It can also tolerate coastal conditions. Well adapted to street tree plantings, especially those which have limited vertical space for crown expansion.","Erectum","Leaf type","simple"
"18","Abies concolor","One of the best firs for the east, white fir reaches a mature height of 75 feet or more but is often much smaller in the landscape, 40 to 50 feet. It has a pyramidal shape and horizontal branching with the lower branches drooping toward the ground. The tree should be grown in an open area so the lower branches can touch the ground. When branched to the ground, white fir will cast dense shade, which kills turf grass. The foliage is a wonderful blue-gray that appears much like that of the Colorado blue spruce. White fir may grow one and one-half feet per year with good growing conditions. This tree can take exposure and will withstand some heat and drought better than most firs. Abies firma is much more heat-tolerant, has green glossy foliage, and grows even further south into USDA hardiness zone 8.",NA,"Leaf type","simple"
"19","Acer palmatum","This Japanese maple has a mounded shape with an ultimate height or about 15 feet and a spread to about 20 feet. The dark red, simple leaves are finely divided into lobes, and the sinuses and so deep that leaves appear to be palmately compound. The slow growth rate makes this nicely suited to residential landscapes. Its popularity is due mostly to the delicate leaves that stay red for most of the summer. Leaves may turn to greenish red in the hot weather in the southern part of its range. The multiple trunks are muscular-looking, picturesque, grey, and show nicely when lighted at night. Fall color is reddish and less striking than other Japanese maples. The globose canopy shape looks best when it is allowed to branch to the ground. Lower foliage branches can be thinned to display the attractive bark and trunk structure.","Dissectum Atropurpureum","Leaf type","simple"
"20","Ostrya virginiana","This shade-tolerant tree slowly grows to 50 feet in height with a 25 to 30-foot spread but is often 25 to 40 feet tall, forming an oval or round canopy.  Hophornbeam has a lovely yellow fall color, and the small nutlets, which ripen in summer and fall, are used by birds and mammals during the winter.  Bark is an attractive orange or grayish brown peeling off in longitudinal strips.  The finely-textured crown casts a medium or dense shade in full sun, but is more open in the shade casting a light shadow.",NA,"Leaf type","simple"
"21","Pyrus calleryana","`Bradford' is the original introduction of Callery Pear and has an inferior branching habit when compared to other cultivars which have since been developed.  It has many vertical limbs with embedded bark packed closely on the trunk and grows about 40 feet high by 30 to 45 feet wide but the crown is dense and the branches long and not tapered, making it quite susceptible to wind and ice damage and other breakage.  However, it does put on a gorgeous, early spring display of pure white blossoms, and the small, red/brown fruits which follow will attract quite a number of birds who find them delicious.  Fruit set may be increased by planting two or more cultivars of Callery Pear together.  Fall color is incredible, ranging from red and orange to dark maroon.","Bradford","Leaf type","simple"
"22","Cercis canadensis","The state tree of Oklahoma, Eastern Redbud is a moderate to rapid-grower when young, reaching a height of 20 to 30 feet.  `Flame' Eastern Redbud shows double pink flowers all over the tree in spring, just before the leaves emerge.  Thirty-year-old specimens are rare but they probably can reach 35 feet in height forming a rounded vase.  The pink flowers are displayed later than the species and are sterile so there is no fruit set.  `Flame' Eastern Redbud has an irregular growth habit and is more upright than the species when young but forms a graceful flat-topped vase-shape or globe as it gets older.  The tree usually branches low on the trunk, and if left intact forms a graceful multitrunked habit.  Be sure to avoid weak forks by pruning to reduce the size of lateral branches and save those which form a `U'-shaped crotch, not a `V'.  Keep them less than half the diameter of the main trunk to increase longevity of the tree.  Do not allow multiple trunks to grow with tight crotches, instead space branches about 6 to 10 inches apart along a main trunk.  Yellow (although somewhat variable and unreliable) fall color and tolerance to partial shade make this a suitable, attractive tree for understory or specimen planting.  Best not used as a street tree due to low disease resistance and short life, but is nice in commercial and residential landscapes.  Plant in a shrub border for a spring and fall color display.","Flame","Leaf type","simple"
"23","Cercis canadensis","`Forest Pansy' Eastern Redbud is a moderate to rapid-grower, 20 to 30 feet in height, which has red twigs and beautiful, shimmering, purple/red new leaves, which fade to purple/green during the summer in its southern range (USDA hardiness zones 7, 8 and 9).  The veins on the backs of the leaves are a deep maroon and make a striking contrast with the light grey/green leaf.  The splendid, purple/pink flowers appear all over the tree in spring, just before the leaves emerge.  `Forest Pansy' Eastern Redbud has an irregular growth habit when young but forms a graceful, flat-topped, vase shape as it gets older.  The tree usually branches low on the trunk, and if left intact forms a graceful multitrunked habit.  Be sure to avoid weak forks by pruning to reduce the size of the lateral branches and save those which form `U'-shaped crotches, not a `V'-shaped crotch.  Keep them less than half the diameter of the main trunk to prevent branch splitting.  This will increase the longevity of the tree.","Forest Pansy","Leaf type","simple"
"24","Cercis canadensis","The state tree of Oklahoma, eastern redbud is a moderate to rapid grower when young, reaching a height of 20 to 25 feet. 'Silver Cloud' has variegated leaves blotched with white. Thirty-year-old specimens are rare, but they probably can reach 25 to 30 feet in height forming a rounded vase. The pink flowers are much less noticeable than on the species. Eastern redbud has an irregular growth habit when young but forms a graceful flat-topped vase-shape or globe as it gets older. The tree usually branches low on the trunk, and if left intact forms a graceful multi-trunked habit. Be sure to avoid weak forks by pruning to reduce the size of lateral branches and save those that form a U-shaped crotch, not a V. Keep them less than half the diameter of the main trunk to increase longevity of the tree. Do not allow multiple trunks to grow with tight crotches, instead space branches about 6 to 10 inches apart along a main trunk. Yellow (although somewhat variable and unreliable) fall color and tolerance to partial shade make this a suitable, attractive tree for understory or specimen planting. Best not used as a street tree due to low disease resistance, poor tolerance to full sun and short life, but is nice in commercial and residential landscapes. Plant in a shrub border for the unusually variegated foliage.","Silver Cloud","Leaf type","simple"
"25","Cercis canadensis","The state tree of Oklahoma, redbud is a moderate to rapid-grower when young, reaching a height of 20 to 30 feet.  Thirty-year-old specimens are rare but they can reach 35 feet in height, forming a rounded vase. The bright white flowers appear all over the tree in spring, just before the leaves emerge. Redbud has an irregular growth habit when young but forms a graceful flat-topped vase-shape or globe as it gets older. The tree usually branches low on the trunk, and if left intact forms a graceful multi-trunked habit. Be sure to avoid weak forks by pruning to reduce the size of lateral branches. Keep them less than half the diameter of the main trunk to increase longevity of the tree. Do not allow multiple trunks to grow with tight crotches, instead space branches about 6 to 10 inches apart along a main trunk. Yellow (although somewhat variable and unreliable) fall color and tolerance to partial shade make this a suitable, attractive tree for understory or specimen planting. Best not used extensively as a street tree due to low disease resistance and short life, but is nice in commercial and residential landscapes. Plant in a shrub border for a spring and fall color display.",NA,"Leaf type","simple"
"26","Photinia glabra","Widely planted for its attractive, bright-red, new leaf growth, Japanese photinia is a densely-foliated, broadleaf evergreen which grows 15 to 20 feet in height. Bright red leaves among the dark green ones afford a bit of foliage interest throughout the fall and winter in southern climates (USDA hardiness zones 8 and 9). The fragrant, four-inch-wide flower clusters appear in early spring and are followed by somewhat showy, red berries which ripen to black.",NA,"Leaf type","simple"
"27","Cornus florida","The state tree of Virginia, flowering dogwood grows 20 to 25 feet tall and spreads 12 to 15 feet. This is one of the most popular red-flowered cultivars. It is usually trained as a picturesque multi-trunked tree. The flowers consist of four bracts that subtend the small head of yellow flowers. The bracts are deep red and very striking. The fall color is usually bronze and the bright red fruits are often eaten by birds. Fall color is more vivid in USDA hardiness zones 5 to 8a. Branches on the lower half of the crown grow horizontally, those in the upper half are more upright. In time, this can lend a strikingly horizontal impact to the landscape, particularly if some branches are thinned to open up the crown. Lower branches left on the trunk will droop to the ground, creating a wonderful landscape feature.","Cherokee Chief","Leaf type","simple"
"28","Cornus florida","The state tree of Virginia, flowering dogwood grows 20 to 35 feet tall and spreads 25 to 30 feet. This cultivar has tri-colored leaves with yellow and light green markings. Leaves turn mostly green during the summer in the southern part of its range. The tree can be trained with one central trunk or as a picturesque multi-trunked tree. The flowers consist of four bracts which subtend the small head of yellow flowers. The bracts are white and have a fall color of red to pink. The bright red fruits are often eaten by birds. Fall color is more vivid in USDA hardiness zones 5 to 8a. Branches on the lower half of the crown grow horizontally, those in the upper half are more upright. In time, this can lend a strikingly horizontal impact to the landscape, particularly if some branches are thinned to open up the crown. Lower branches left on the trunk will droop to the ground, creating a wonderful landscape feature.","First Lady","Leaf type","simple"
"29","Cornus florida","The state tree of Virginia, flowering dogwood grows 20 to 35 feet tall and spreads 25 to 30 feet. It can be trained with one central trunk or as a picturesque multi-trunked tree. The flowers consist of four bracts which subtend the small head of yellow flowers. The bracts may be pink or red depending on cultivar but the species color is white. The fall color depends on site and seed source but on most sun grown plants will be red to maroon. The bright red fruits are often eaten by birds. Fall color is more vivid in USDA hardiness zones 5 to 8a. Branches on the lower half of the crown grow horizontally, those in the upper half are more upright. In time, this can lend a strikingly horizontal impact to the landscape, particularly if some branches are thinned to open up the crown. Lower branches left on the trunk will droop to the ground, creating a wonderful landscape feature.",NA,"Leaf type","simple"
"30","Betula pendula","European birch is graceful and ornamental with wonderful yellow fall color but is susceptible to fatal attacks of bronze birch borer. The leaves are often browned by birch leaf miner. When grown, plan to provide the necessary insect control and provide the necessary cultural conditions for best growth. European birch grows rapidly, reaching a height of 35 to 75 feet.  Lawn grasses grow well in its light shade. A moist soil and a regular fertilization program plus watering in dry weather are suggested. Although popular, the tree requires more care and spraying than other ornamental trees. Not a low maintenance tree. Maintaining a good mulch around the root zone is helpful.",NA,"Leaf type","simple"
