"","Species","Description","Cultivar","Trait","data"
"61","Acer rubrum","This cultivar of red maple has an oval to rounded shape and is a fast grower with strong wood, reaching a height of 40 to 50 feet. It and 'Red Sunset' are the most popular red maples in cultivation, probably due to their dependable fall color and vigorous growth. Unless irrigated or on a wet site, it is best used north of USDA hardiness zone 9. Trees are often seen shorter in the southern part of its range unless growing next to a stream or on a wet site. This tree is much preferred over red maple, silver maple, or boxelder when a fast growing maple is needed. The newly emerging leaves and red flowers and fruits signal that spring has come. They appear in December and January in Florida, later in the northern part of its range. The seeds of red maple are quite popular with squirrels and birds. This tree if sometimes confused with red-leaved cultivars of Norway maple.","October Glory","Leaf type","simple"
"62","Nyssa sylvatica","Sourgum is a hardwood tree which grows to 75 feet tall, has a medium growth rate, pyramidal shape with horizontal branches growing from a typically straight trunk.  But the shape of the crown varies from tree to tree and, unfortunately, this is looked upon by some architects as undesirable.  As the tree grows to 10 and 15-years-old, crown form becomes more uniform among trees.  Lower branches droop with age and will need to be removed if used as a street tree.  Growth habit is similar to pin oak, a tree which many people are familiar with.  Providing a brilliant display of red to deep purple foliage in the fall, Sourgum surprises most people since it does not particularly stand out in the landscape until then.  The small, blue fruits may be considered a litter nuisance in urban/suburban plantings but are quite popular with many birds and mammals, and they wash away quickly.",NA,"Leaf type","simple"
"63","Quercus palustris","Pin oak is one of the most utilized (perhaps overused) oaks in the midwest and eastern United States. Popular due to the attractive pyramidal shape and straight, dominant trunk, even on older specimens, it exhibits chlorosis on high pH and limestone soils because of iron-deficiency and so is not highly recommended for these sites. Green, glossy leaves borne on relatively small-diameter branches give way to brilliant red to bronze fall color attracting attention in the landscape. Some brown leaves persist on the tree into the winter providing interest to some people. Others do not care to use pin oak because of the leaf persistence characteristic.",NA,"Leaf type","simple"
"64","Maclura pomifera","This deciduous North American native tree rapidly grows 30 to 40 feet tall with a spread of 20 to 40 feet and creates a dense canopy, making it useful as a windbreak.  Young trees can develop an upright, pyramidal habit.  The large, three to six-inch-long by two to three-inch-wide, shiny, dark green leaves turn bright yellow in fall before dropping, although this color change is not quite as noticeable on trees grown in the southeastern United States.  The bark is deeply furrowed and has an orange tinge to it, and the strong, durable wood is bright orange in color.",NA,"Leaf type","simple"
"65","Nerium oleander","Oleander is a wonderful easy-care, rounded shrub or small tree, with long, dark green leaves and an abundance of single or double, sometimes fragrant flowers. 'Calypso' has single, cherry red flowers and is very hardy. Often trained into an attractive small tree, multi-branched oleander also does well as a quick-growing screen or large specimen planting. Planted on five to seven foot centers, a row of oleander makes a nice screen for a large residence or other large-scale landscape.","Calypso","Leaf type","simple"
"66","Nerium oleander","Oleander is a wonderful easy-care, rounded shrub or small tree, with long, dark green leaves and an abundance of single or double, sometimes fragrant flowers. 'Hawaii' has single salmon-pink flowers with yellow throats. Often trained into an attractive small tree, multi-branched oleander also does well as a quick-growing screen or large specimen planting. Planted on five to seven foot centers, a row of oleander makes a nice screen for a large residence or other large-scale landscape.","Hawaii","Leaf type","simple"
"67","Nerium oleander","Oleander is a wonderful easy-care, rounded shrub or small tree, with long, dark green leaves and an abundance of single or double, sometimes fragrant flowers. 'Isle of Capri' has single, light yellow flowers. Often trained into an attractive small tree, multi-branched oleander also does well as a quick-growing screen or large specimen planting. Planted on five to seven foot centers, a row of oleander makes a nice screen for a large residence or other large-scale landscape.","Isle of Capri","Leaf type","simple"
"68","Nerium oleander","Oleander is a wonderful easy-care, rounded shrub or small tree, with long, dark green leaves and an abundance of single or double, sometimes fragrant flowers. 'Sister Agnes' has single pure white flowers. Often trained into an attractive small tree, multi-branched oleander also does well as a quick-growing screen or large specimen planting. Planted on five to seven foot centers, a row of oleander makes a nice screen for a large residence or other large-scale landscape.","Sister Agnes","Leaf type","simple"
"69","Nerium oleander","Oleander is a wonderful easy-care, rounded shrub or small tree, with long, dark green leaves and an abundance of single or double, sometimes fragrant flowers. 'Variegata' has lavender flowers and variegated leaves. Often trained into an attractive small tree, multi-branched oleander also does well as a quick-growing screen or large specimen planting. Planted on five to seven foot centers, a row of oleander makes a nice screen for a large residence or other large-scale landscape.","Variegata","Leaf type","simple"
"70","Fraxinus velutina","This fast-growing, deciduous, native North American tree reaches a height of 30 to 50 feet, depending upon cultural conditions.  It is capable of growing taller in its native habitat.  The three to six-inch-long leaves are divided into multiple leaflets and turn a brilliant yellow in fall before dropping.  The inconspicuous, green, springtime flowers are followed by the production of showy, persistent fruits.  The tree has been widely grown in California and in parts of the west including Texas.",NA,"Leaf type","odd-pinnately compound"
"71","Cupressus sempervirens","With its narrow columnar habit of growth, this evergreen forms tall, dark green columns 25 to 40 feet in height but are often shorter in the east. 'Glauca' has blue-green foliage and tight columnar form. Trees are normally no more than 3 feet wide. The scale-like leaves lend a very fine texture to any setting. Planted three feet apart, they make a dense screen. Italian cypress is often used for framing, as a strong accent around large buildings, or in the formal landscape but does not lend itself well to many home landscapes. It quickly grows much too tall for most residential landscapes, looking much like a green telephone pole.","Glauca","Leaf type","simple"
"72","Cupressus sempervirens","With its narrow columnar habit of growth, this evergreen forms tall, dark green columns 40 to 60 feet in height in the western United States but are often much shorter. Trees are normally no more than three feet wide. The scale-like leaves lend a very fine texture to any setting. Planted 3 feet apart, they make a dense screen. Italian cypress is often used for framing, as a strong accent around large buildings, or in the formal landscape but does not lend itself well to many home landscapes. It quickly grows much too tall for most residential landscapes, looking much like a green telephone pole.",NA,"Leaf type","simple"
"73","Calocedrus decurrens","This stately native evergreen tree slowly grows straight up in a very narrow cone or columnar shape to a height of 70- to 100-feet or more in the wild, 40- to 60-feet in landscapes, yet is only 8- to 12-feet wide at maturity. The branches<U+0097>which are densely clothed with flat, shiny, dark green, aromatic needles<U+0097>extend to the ground and remain on the tree unless shaded-out by other trees, making California incense-cedar ideal for use as a screen, hedge, or windbreak. Small, 1-inch long cones are produced at branch tips and are quite persistent, the seeds providing a welcome treat for many varieties of birds and wildlife. Although growth is slow, California Incense-Cedar trees are extremely long-lived, surviving 500 to 1000 years in the wild. Mature specimens have attractive, brick-red, flaky, furrowed bark.",NA,"Leaf type","simple"
"74","Thuja occidentalis","This slow-growing tree reaches 25 to 40 feet in height and spreads to about 10 to 12 feet wide, preferring a wet or moist, rich soil. Transplanting is moderately easy if plants are root-pruned and either balled and burlapped or potted. White cedar likes high humidity and tolerates wet soils and some drought. The foliage turns brownish in winter, especially on cultivars with colored foliage and on exposed sites open to the wind.",NA,"Leaf type","simple"
"75","Acer negundo","Boxelder forms a 40-to 50-foot-tall rounded canopy of very light green foliage. The boxelder is an undesirable tree for many urban situations and in some cities, planting it may be illegal. The undesirable characteristics are brittle, weak wood, short life, susceptibility to boxelder bug, and trunk decay. But the tree will grow just about anywhere and therefore it may have uses due to its adaptability. The best thing about the tree is that it will grow on adverse sites where more desirable trees may not. If you use the tree, plant it for its quick growth, but interplant with more desirable trees to provide for a lasting tree canopy. Boxelder is native along streambanks over a wide area of the United States, grows along flood plains, and naturalizes quickly on disturbed sites. It may be best to restrict planting to these areas. It is tolerant of drought and was planted as a shelter-belt tree.",NA,"Leaf type","odd-pinnately compound"
"76","Juniperus scopulorum","Juniperus scopulorum is a native plant that can be found in the western United States. In general, Juniperus scopulorum is a slow growing evergreen tree with a narrow, pyramidal habit that grows to a mature height of 30 to 40 feet. It is similar to other junipers in that it requires a full sun exposure and will tolerate dry and droughty soils. Juniperus scopulorum is useful as a privacy screen or specimen. This Juniper is difficult to grow in the south due to disease problems. If you try it, provide excellent drainage and keep the foliage dry.",NA,"Leaf type","simple"
"77","Alnus glutinosa","A popular tree of moist to wet soils, common alder is a moderate- to fast-growing (two feet per year) deciduous tree that usually grows to 40 to 50 feet in height with a 20- to 40-foot spread and a 12 to 18-inch trunk but is capable of reaching 80 feet in height in the woods. It is not native but has escaped from cultivation and will form pure stands or thickets in disturbed wet sites. Pyramidal when young, common alder often has multiple stems, making it ideal for use as a screen or specimen, the trees eventually becoming more rounded or oval as they mature. The two- to four-inch-wide, dark green, roundish leaves with toothed edges and pale undersides are joined in spring by rather insignificant male and female flowers. Foliage remains green well into the fall. It is the fruits that are most interesting<U+0097>small, nutlike, one-inch ""cones"" that persist throughout the fall and winter, long after the darkening leaves have fallen. These fruits, along with the attractive, dark brown, furrowed bark and multi-stemmed growth habit, make common alder an attractive landscape specimen throughout the winter. The fruits are food for a variety of wildlife.",NA,"Leaf type","simple"
"78","Alnus glutinosa","A popular tree of moist to wet soils, common alder is a moderate- to fast-growing (two feet per year) deciduous tree. This upright, columnar cultivar to 20-foot spread and a 12- to 18-inch trunk but is capable of growing taller. The species is not native but has escaped from cultivation and will form pure stands or thickets in disturbed wet sites. The two- to four-inch-wide, dark green, roundish leaves with toothed edges and pale undersides are joined in spring by rather insignificant male and female flowers. Foliage remains green well into the fall. It is the fruits that are most interesting<U+0097>small, nutlike, one-inch ""cones"" that persist throughout the fall and winter, long after the darkening leaves have fallen. These fruits, along with the attractive, dark brown, furrowed bark, make alder an attractive landscape specimen throughout the winter. The fruits are food for a variety of wildlife.","Pyramidalis","Leaf type","simple"
"79","Cornus florida","The state tree of Virginia, flowering dogwood grows 20 to 35 feet tall and spreads 25 to 30 feet. It can be trained with one central trunk or as a picturesque multi-trunked tree. The flowers consist of four bracts which subtend the small head of yellow flowers. The bracts are red and fall leaf color is red to purple. Fall color is more vivid in USDA hardiness zones 5 to 8a. Branches on the lower half of the crown grow horizontally, those in the upper half are more upright. In time, this can lend a strikingly horizontal impact to the landscape, particularly if some branches are thinned to open up the crown. Lower branches left on the trunk will droop to the ground, creating a wonderful landscape feature. The bright red fruits are often eaten by birds.","Sweetwater Red","Leaf type","simple"
"80","Cornus florida","The state tree of Virginia, flowering dogwood grows 20 to 35 feet tall and spreads 25 to 30 feet. This cultivar appears to be well adapted to USDA hardiness zones 8 and 9. It can be trained with one central trunk or as a picturesque multi-trunked tree. The flowers consist of four bracts which subtend the small head of yellow flowers. The bracts are white and larger than the species. The fall color is red to maroon. Fall color is more vivid in USDA hardiness zones 5 to 8a. The bright red fruits are often eaten by birds. Branches on the lower half of the crown grow horizontally, those in the upper half are more upright. In time, this can lend a strikingly horizontal impact to the landscape, particularly if some branches are thinned to open up the crown. Lower branches left on the trunk will droop to the ground, creating a wonderful landscape feature.","Weavers White","Leaf type","simple"
"81","Platanus orientalis","Arborvitae is an easily-recognized shrub, with its large teardrop shape and flattened branchlets held vertically.  Most young plants are seen as shrubs, but they can be pruned into a small tree by removing the lowest branches.  This forms a distinctive vase shape and is common on older landscapes where the plant was located too close to a walk or home.",NA,"Leaf type","simple"
"82","Liriodendron tulipifera","Tuliptree grows 80 to 100 feet tall and maintains a fairly narrow oval crown, even as it grows older.  Trunks become massive in old age, becoming deeply furrowed with thick bark.  The tree maintains a straight trunk and generally does not form double or multiple leaders.  Older trees have several large-diameter major limbs in the top half of the crown.  Tuliptree has a moderate to rapid (on good sites) growth rate at first but slows down with age.  The soft wood reportedly is subject to storm damage but the trees held up remarkably well in the south during hurricane `Hugo'.  It is probably stronger than given credit for.  The largest trees in the east are in the  Joyce Kilmer Forest in NC, some reaching more than 150 feet with seven-foot diameter trunks.  The fall color is gold to yellow being more pronounced in the northern part of its range.  The scented, tulip-like, greenish-yellow flowers appear in mid-spring but are not as ornamental as those of other flowering trees because they are far from view.",NA,"Leaf type","simple"
"83","Pyrus calleryana","`Redspire' Callery Pear quickly grows 35 to 45 feet high and 20 feet wide, with upright-spreading, thornless branches.  The narrow crown enable this tree to be used in tight overhead spaces.  The silhouette appears as a fat column growing wider than `Whitehouse' and `Capital' but narrower than `Bradford' and `Aristocrat'.  In spring before the new leaves unfold, the tree puts on a nice display of pure white flowers larger than `Bradford' or `Aristocrat'.  Flowering may be subdued in USDA hardiness zone 8b and it occurs at about the same time as `Bradford' Callery Pear.  The leaves emerge as red/purple, then become 1.5 to 3 inches long, glossy green with wavy margins and a red blush.  They turn yellow to orange in fall in the south putting on an attractive display before dropping.  Fall color may be subdued in the north.  The small, pea-sized, red/brown fruits which form are quite attractive to birds and other wildlife, and mummify on the tree persisting for several months to a year.  Planting two or more cultivars of Callery Pear together could increase fruit set.","Redspire","Leaf type","simple"
"84","Fraxinus excelsior","Common Ash is a broad, spreading, deciduous tree, capable of reaching 100 feet or more in height but most often seen growing at a moderate pace at 70 to 80 feet with a 60 to 90-foot spread.  The dark green, multi-divided leaves are 10 to 12 inches long and usually drop off in autumn while still green but some cultivars may turn an attractive yellow first.  The inconspicuous springtime flowers are followed by clusters of 1.5-inch-long, winged fruits which turn brown and remain on the trees well after the leaves have fallen.  The low-branched, rounded silhouette of naked branches on top of the short trunk and the black, dormant leaf buds help to make common Ash an attractive winter landscape element.",NA,"Leaf type","odd-pinnately compound"
"85","Aesculus glabra","A true North American native, Ohio buckeye forms a short trunk with a low branching structure, creating an oval to rounded canopy 40 to 50 feet wide on a tree 50 to 70 feet tall. The four- to six-inch-long, coarse, bright green, palmately compound leaves have an unpleasant odor when crushed, as do the twigs, giving this tree its other common name of ""fetid buckeye"". The fragrance should be a warning sign for this plant since all parts of it are poisonous, a factor which should be considered when placing it in the landscape. One of the first trees to shed its leaves in autumn, Ohio buckeye puts on a vivid display of bright orange and yellow fall foliage. The spring flowers are also quite showy, the erect, yellow/green, six-inch-high panicles decorating the branches. The one- to two-inch-long, showy, brown fruits ripen in late summer and may become a litter problem since they are very prickly. These fruits are quite popular with squirrels and other wildlife.",NA,"Leaf type","palmately compound"
"86","Koelreuteria paniculata","Goldenrain tree grows 30 to 40 feet tall with an equal spread, in a broad, somewhat irregular globe-shape. Some trees appear vase-shaped. Although it has a reputation for being weak wooded, it is rarely attacked by pests and grows in a wide range of soils, including high pH soils. Goldenrain tree tolerates dryness and casts little shade because of the open growth habit. It makes a good street or parking lot tree, particularly where overhead or soil space is limited, due to its adaptive abilities. The tree grows moderately and bears large panicles of bright yellow flowers in May (USDA hardiness zone 9) to July (USDA hardiness zone 6) when few other trees bloom. It is not as showy as Koelreuteria bipinnata but is much more cold-tolerant. The seed pods look like brown Chinese lanterns and are held on the tree well into the fall.",NA,"Leaf type","even-pinnately compound, odd-pinnately compound"
"87","Morus alba","This group of mulberries is fruitless, a definite plus when compared to the mess created by the abundant fruits of the common white mulberry. The plant quickly forms a dark green mass of foliage from a short trunk, or group of trunks. This gives many people reason to plant the tree. However, it is quite sensitive to ice damage, has invasive surface roots and drops leaves in summer.",NA,"Leaf type","simple"
"88","Peltophorum pterocarpum","This upright, handsome, spreading, semievergreen tree has a rounded canopy and is capable of reaching 50 feet in height with a 35 to 50-foot spread.  Form can be quite variable from tree to tree, unfortunately, eliminating this plant from the palette of many architects.  With proper training and pruning in the nursery and in the landscape, a more uniform crown will develop.  The dark green, delicate, feathery leaflets provide a softening effect for the tree's large size and create a welcoming, dappled shade.  From May through September, the entire tree's canopy is smothered with a yellow blanket of flowers, appearing in showy, terminal panicles and exuding a delicious, grape-like perfume.  These flower clusters are followed by four-inch-long seed pods which ripen to a brilliant, dark, wine-red.",NA,"Leaf type","bipinnately compound, even-pinnately compound"
"89","Pyrus calleryana","`Aristocrat' Callery Pear quickly grows 35 to 45 feet high and 30 to 35 feet wide, with widely-spaced, upright-spreading, thornless branches.  The more dominant trunk and open form of `Aristocrat' Callery Pear helps to make it less susceptible to wind and ice damage than `Bradford'.  Branch angles are wider and lateral branches grow at a slower rate than on `Bradford', therefore the branches are better attached to the trunk.  In spring before the new leaves unfold, the tree puts on a brilliant display of pure white flowers which, unfortunately, do not have a pleasant fragrance.  The leaves emerge as red/purple, then become 1.5 to 3 inches long, glossy green with wavy margins and a red blush.  They turn red again in fall before dropping.  The small, pea-sized, red/brown fruits which form are quite attractive to birds and other wildlife, and mummify on the tree persisting for several months to a year.  Planting two or more cultivars of Callery Pear together could increase fruit set.","Aristocrat","Leaf type","simple"
"90","Ginkgo biloba","Ginkgo is practically pest-free, resistant to storm damage, and casts light to moderate shade.  Young trees are often very open but they fill in to form a denser canopy.  It makes a durable street tree where there is enough overhead space to accommodate the large size.  The shape is often irregular with a large branch or two seemingly forming its own tree on the trunk.  But this does not detract from its usefulness as a city tree unless the tree will be growing in a restricted overhead space.  If this is the case, select from the narrow upright cultivars such as `Princeton Sentry' and `Fairmont'.  Ginkgo tolerates most soil, including compacted, and alkaline, and grows slowly to 75 feet or more tall.  The tree is easily transplanted and has a vivid yellow fall color which is second to none in brilliance, even in the south.  However, leaves fall quickly and the fall color show is short.",NA,"Leaf type","simple"
"91","Ginkgo biloba","This male cultivar of Ginkgo is practically pest-free, resistant to storm damage, and casts dense shade.  The tree grows to at least 50 feet tall but the original tree in Fairmont Park, Philadelphia has a spread of only about 15 to 18 feet and resembles a fat, billowy column or oval.  The dense crown makes it suitable as a screen or noise buffer.  It makes a durable street tree where there is enough overhead vertical space to accommodate the large size.  It has good usefulness as a city tree especially where there is narrow overhead space.  There are other cultivars with narrow upright crowns including `Princeton Sentry' and `Fastigiata'.  Ginkgo tolerates most soil, including compacted, and alkaline.  The tree is easily transplanted and has a vivid yellow fall color which is second to none in brilliance, even in the south.  However, leaves fall quickly and the fall color show is short.  Unlike the species, the tree does not set fruit.","Fairmont","Leaf type","simple"
"92","Ginkgo biloba","This male cultivar of Ginkgo is practically pest-free, resistant to storm damage, and casts dense shade.  It makes a durable street tree especially where overhead vertical space limits selection of wide trees.  The shape is a symmetrical pyramid growing about 50 feet tall and 20 to 25 feet wide, which is quite unlike the open spreading habit of the species.  There are other narrow, upright cultivars such as `Princeton Sentry' and `Fairmont'.  Ginkgo tolerates most soil, including compacted, and alkaline.  The tree is easily transplanted and has a vivid yellow fall color which is second to none in brilliance, even in the south.  However, leaves fall quickly and the fall color show is short.  Unlike the species, the tree does not set fruit.","Lakeview","Leaf type","simple"
"93","Acer pseudoplatanus","This large deciduous tree is normally seen at 40 to 60 feet in height although sycamore maple is capable of reaching over 100 feet in height. The spreading branches form an oval or rounded canopy and the dark green, three-to seven-inch-diameter, lobed leaves do not ordinarily become showy in the fall, changing only to a muted yellow before dropping, but this will vary. The gray to reddish-brown, scaly bark flakes off in small scales to reveal the showy, orange, inner bark. The green, springtime flowers appear in three-to six-inch-long hanging panicles among the leaves in late spring and are followed by one-to two-inch-long, winged seeds.",NA,"Leaf type","simple"
